{
  "name": "crash",
  "description": "",
  "seed": -1468431909,
  "duration_ms": 30000,
  "warmup_ms": 0,
  "total_request_limit": 0,
  "manager_workers": 0,
  "servers": [
    {
      "weight": 1,
      "capacity": 1.0,
      "max_parallel_requests": 1,
      "start_at_ms": 0
    },
    {
      "weight": 2,
      "capacity": 0.8,
      "max_parallel_requests": 1,
      "start_at_ms": 0
    },
    {
      "weight": 3,
      "capacity": 0.6,
      "max_parallel_requests": 1,
      "start_at_ms": 0,
      "crash_at_ms": 10000
    }
  ],
  "client_groups": [
    {
      "count": 20,
      "sticky_scope": "none",
      "inter_arrival_ms": {
        "type": "normal",
        "center": 10,
        "deviation": 4
      },
      "task_cost": {
        "type": "normal",
        "center": 50,
        "deviation": 10
      },
      "max_requests": 0
    }
  ]
}