{
  "name": "stickyDefault",
  "description": "",
  "seed": 42,
  "duration_ms": 15000,
  "warmup_ms": 0,
  "total_request_limit": 0,
  "manager_workers": 0,
  "servers": [
    {
      "weight": 5,
      "capacity": 1.0,
      "background_load": {
        "type": "constant",
        "value": 0
      },
      "max_parallel_requests": 2,
      "start_at_ms": 0
    },
    {
      "weight": 10,
      "capacity": 1.0,
      "background_load": {
        "type": "constant",
        "value": 0
      },
      "max_parallel_requests": 2,
      "start_at_ms": 0
    },
    {
      "weight": 15,
      "capacity": 1.0,
      "background_load": {
        "type": "constant",
        "value": 0
      },
      "max_parallel_requests": 2,
      "start_at_ms": 0
    },
    {
      "weight": 20,
      "capacity": 1.0,
      "background_load": {
        "type": "constant",
        "value": 0
      },
      "max_parallel_requests": 2,
      "start_at_ms": 0
    }
  ],
  "client_groups": [
    {
      "count": 25,
      "sticky_scope": "client",
      "inter_arrival_ms": {
        "type": "uniform",
        "min": 0,
        "max": 10000
      },
      "task_cost": {
        "type": "constant",
        "value": 1
      },
      "max_requests": 10
    },
    {
      "count": 25,
      "sticky_scope": "client",
      "inter_arrival_ms": {
        "type": "uniform",
        "min": 0,
        "max": 10000
      },
      "task_cost": {
        "type": "constant",
        "value": 1
      },
      "max_requests": 10
    },
    {
      "count": 25,
      "sticky_scope": "client",
      "inter_arrival_ms": {
        "type": "uniform",
        "min": 0,
        "max": 10000
      },
      "task_cost": {
        "type": "constant",
        "value": 1
      },
      "max_requests": 10
    },
    {
      "count": 25,
      "sticky_scope": "client",
      "inter_arrival_ms": {
        "type": "uniform",
        "min": 0,
        "max": 10000
      },
      "task_cost": {
        "type": "constant",
        "value": 1
      },
      "max_requests": 10
    },
    {
      "count": 25,
      "sticky_scope": "client",
      "inter_arrival_ms": {
        "type": "uniform",
        "min": 0,
        "max": 10000
      },
      "task_cost": {
        "type": "constant",
        "value": 1
      },
      "max_requests": 10
    },
    {
      "count": 25,
      "sticky_scope": "client",
      "inter_arrival_ms": {
        "type": "uniform",
        "min": 0,
        "max": 10000
      },
      "task_cost": {
        "type": "constant",
        "value": 1
      },
      "max_requests": 10
    }
  ]
}