{
  "name": "churnGood",
  "description": "",
  "seed": 42,
  "duration_ms": 30000,
  "warmup_ms": 0,
  "total_request_limit": 0,
  "manager_workers": 0,
  "servers": [
    {
      "weight": 10,
      "capacity": 1.0,
      "background_load": {
        "type": "constant",
        "value": 0
      },
      "max_parallel_requests": 2,
      "start_at_ms": 0,
      "crash_at_ms": 12000
    },
    {
      "weight": 20,
      "capacity": 1.0,
      "background_load": {
        "type": "constant",
        "value": 0
      },
      "max_parallel_requests": 2,
      "start_at_ms": 0,
      "crash_at_ms": 6000
    },
    {
      "weight": 20,
      "capacity": 1.0,
      "background_load": {
        "type": "constant",
        "value": 0
      },
      "max_parallel_requests": 2,
      "start_at_ms": 7000,
      "crash_at_ms": 12000
    },
    {
      "weight": 10,
      "capacity": 1.0,
      "background_load": {
        "type": "constant",
        "value": 0
      },
      "max_parallel_requests": 2,
      "start_at_ms": 13000,
      "crash_at_ms": 24000
    },
    {
      "weight": 20,
      "capacity": 1.0,
      "background_load": {
        "type": "constant",
        "value": 0
      },
      "max_parallel_requests": 2,
      "start_at_ms": 13000,
      "crash_at_ms": 18000
    },
    {
      "weight": 20,
      "capacity": 1.0,
      "background_load": {
        "type": "constant",
        "value": 0
      },
      "max_parallel_requests": 2,
      "start_at_ms": 19000,
      "crash_at_ms": 24000
    },
    {
      "weight": 10,
      "capacity": 1.0,
      "background_load": {
        "type": "constant",
        "value": 0
      },
      "max_parallel_requests": 2,
      "start_at_ms": 24000
    },
    {
      "weight": 20,
      "capacity": 1.0,
      "background_load": {
        "type": "constant",
        "value": 0
      },
      "max_parallel_requests": 2,
      "start_at_ms": 24000,
      "crash_at_ms": 29000
    }
  ],
  "client_groups": [
    {
      "count": 1000,
      "sticky_scope": "none",
      "inter_arrival_ms": {
        "type": "uniform",
        "min": 0,
        "max": 28000
      },
      "task_cost": {
        "type": "constant",
        "value": 2
      },
      "max_requests": 1
    }
  ]
}