{
  "name": "perfect",
  "description": "",
  "seed": 42,
  "duration_ms": 10000,
  "warmup_ms": 0,
  "total_request_limit": 0,
  "manager_workers": 0,
  "servers": [
    {
      "weight": 200,
      "capacity": 1.0,
      "background_load": {
        "type": "constant",
        "value": 0
      },
      "max_parallel_requests": 4,
      "start_at_ms": 0
    },
    {
      "weight": 200,
      "capacity": 1.0,
      "background_load": {
        "type": "constant",
        "value": 0
      },
      "max_parallel_requests": 4,
      "start_at_ms": 0
    },
    {
      "weight": 200,
      "capacity": 1.0,
      "background_load": {
        "type": "constant",
        "value": 0
      },
      "max_parallel_requests": 4,
      "start_at_ms": 0
    }
  ],
  "client_groups": [
    {
      "count": 1000,
      "sticky_scope": "none",
      "inter_arrival_ms": {
        "type": "uniform",
        "min": 0,
        "max": 8000
      },
      "task_cost": {
        "type": "constant",
        "value": 0.05
      },
      "max_requests": 1
    }
  ]
}